;section;speaker;role;text
60;Q&A;John Pfeifer - President & COO;Firm;Yes. So I can't say any -- I mean, I'll say this about the whole company. The access team in terms of their ability to manage through a very rapid decline in the last couple of quarters. The F&E team has just been doing a phenomenal job, the defense team managing that JLTV launch with all this COVID disruption to the workforce. And the commercial team is no different. They've really done a great job continuing on their simplification journey. They're continuing to put building blocks in place, as we speak, as they focus on mixers in 1 site and RCVs in another. There's probably the most headway for margin expansion in this, no surprise, and we expect that, that margin expansion will continue. So we feel like we're going in the right direction with our commercial business.
61;Q&A;Michael Pack - EVP & CFO;Firm;I think, Jerry, I think the big thing with commercial for next year, and that's -- we're not able to make a call yet on their top lines. And I think that's really going to determine where that margin ends up for the year. Certainly, what I'd expect is through the actions we've taken in that business, we're going to have very solid incrementals or decrementals, whichever direction that ends up going.
62;Q&A;Operator;Operator;We have a question from Chad Dillard, Bernstein.
63;Q&A;Catherine Gallagher - Bernstein;Analyst;Yes. I'm asking a question on Chad's behalf. So could you talk about the level of quoting activities you are seeing in fire & emergency compared to a year ago?
64;Q&A;Wilson Jones - CEO & Director;Firm;Well, I will just say that we had an all-time record order year in 2020, so I think that's the best indication of quoting activity that I can provide. Now orders came down a little bit in the fourth quarter. So that's...
65;Q&A;Michael Pack - EVP & CFO;Firm;As expected.
66;Q&A;Wilson Jones - CEO & Director;Firm;Yes, not unexpected. We had a massive order rate in the prior quarter. So it's coming -- or in the -- I should say, our Q2, we had a massive order quarter. So we thought that it would come down a little bit. It always comes down in Q3 and we thought it would be a little bit light in Q4. But I don't think there's any abnormality to our quoting that's happening in F&E today. Our business is looking pretty healthy.
67;Q&A;Michael Pack - EVP & CFO;Firm;Yes.
68;Q&A;Catherine Gallagher - Bernstein;Analyst;Great. And the follow-up is on the $85 million of headwind you were talking about, that is in addition to the sort of the temporary cost coming back, right? Or is that already...
69;Q&A;Michael Pack - EVP & CFO;Firm;Yes, the $85 million, I'll quickly walk through that because it is an important point. So we benefited by $120 million of temporary cost actions in 2020. Those -- that $120 million comes back into our expense run rate in 2021. What we do pick up, though, is a $35 million benefit of permanent actions we've taken and those permanent actions grow to $50 million by 2022.
70;Q&A;Operator;Operator;We have a question from Ann Duignan, JPMorgan.
71;Q&A;Ann Duignan - JPMorgan Chase & Co.;Analyst;Most of my questions have been answered by now. But in your discussion of lower sales year-over-year, half 1, can you just walk us through the different segments and what you're contemplating there? I know we've spent a lot of time on access, but what about the other segments?
72;Q&A;Michael Pack - EVP & CFO;Firm;Ann, we're not breaking it down by segment either. Obviously, I think we have, again, with the backlog in fire & emergency and defense, to give you an idea of the opportunity for the year. The challenge we're facing right now is just with the pandemic. We are facing some workforce availability challenges here in Wisconsin in the fire & emergency and defense segments. And if you look to the fire & emergency segment, when the pandemic first started and we had the shelter-in-place restrictions, it was tougher for customers to come in to pick up fire trucks. That's an important part of that process. And we do have some level of concern that, that could be a headwind early in the year. So that's really what's holding us back from being able to provide a little bit more clarity on that because I think we could see some movement of that volume around between quarters.
73;Q&A;John Pfeifer - President & COO;Firm;Yes. It's really an operational thing. I mean, if you look at the backlogs for defense and fire & emergency, they're really, really healthy. It's a question of how much is COVID going to impact us in terms of our ability to get product out the door.
74;Q&A;Ann Duignan - JPMorgan Chase & Co.;Analyst;Yes. And that's why I asked the question because I was curious looking at the strength of the backlog versus the comment that total sales will be down first half, so I just wanted to dig a little deeper. And I appreciate that it's not -- visibility is not great right now. Just as a follow-up, on the electric vehicles in commercial, you noted that you have 5 trucks going to customers for testing. Have you lost a significant amount of market share or orders because you weren't prepared with electric vehicles? I mean, somebody has won those huge orders that have been announced in the recent 3 to 6 months.
75;Q&A;Wilson Jones - CEO & Director;Firm;So I'm glad you brought that up, a great question. We have not lost ground. We have not lost market share because of electrification. We look at ourselves as being out front on electrification. We have an enormous amount of work happening in electrification. And when you look at those Boise units, they'll be some of the first actual units on the market actually for sale in the refuse collection industry.  When you talk about huge orders, you're talking about companies that are talking about orders in the -- at some point in the future, some of these companies have never made an RCV before in their history. Some of them have never even made a truck before in their history. So the question as to whether or not they can actually do it, I think, is a valid question. But we are out on the forefront in electrification.
76;Q&A;Operator;Operator;There are no further questions at this time. I'd like to turn the floor back over to Wilson Jones for closing comments.
77;Q&A;Wilson Jones - CEO & Director;Firm;Well, I want to thank everyone for hanging in there with us today. I apologize for the technical difficulties. I think it was a major outage going on up in New Jersey. So again, I want to thank you for hanging there with us. I encourage you all to stay safe and healthy as we work through these challenging times. We certainly look forward to speaking with you on a virtual conference or on our next earnings call. Take care, everyone. Thank you.
78;Q&A;Operator;Operator;This concludes today's teleconference. You may disconnect your lines at this time, and thank you for your participation.
