;section;speaker;role;text
48;Q&A;Preston Feight - CEO;Firm;Well, let's just take the last one, you mentioned the dividends. And we announced our dividends yesterday for the first quarter, $0.32 a share, which is a strong indicator of what we've done. We have a great history of dividends and we'll look forward to what our future is going to be and that's a Board decision and we take care of that as we progress through the year, based upon the results. I think that -- I don't think that it's a fair thing to think of it as an '08-'09 kind of a thing, they are just different. Each situation is unique. And what we've got is freight being moved, kind of giving you the kind of the -- the truth of the matter is the freight is being moved. Our Company is well-built. We have a great position in terms of our liquidity, our cash position, our product investments. Our trucks are the best in the world. And that feels pretty good.
49;Q&A;David Raso - Evercore ISI;Analyst;And the comfort in the larger parts business and a business that's more on your own vertically integrated drive train than back then. Is that something else that we should take a little more comfort in versus '09? But at the same time the unevenness of the production, it's really less of almost your decision that when you can ramp up. I mean, is that the yin and yang here better about Parts, a little more uncertain about the Truck margins, just given in a way a bit of out of your hands?
50;Q&A;Preston Feight - CEO;Firm;Sure. We have the stronger foundational parts market. We have the growth in our engine business, right, '08, '09 wasn't here in North America. So, that's good. I think, the other thing to think about the share growth over that timeframe has been significant. So, we've had really strong share growth over that time, which contributes extra volume to us. And PACCAR does a great job. Our team is so good at adjusting the business, both in capital and expense side to think about how the business should be run. And so, we really do adjust to market conditions.
51;Q&A;Operator;Operator;Your next question comes from the line of Joel Tiss of BMO.
52;Q&A;Joel Tiss - BMO;Analyst;So, just to follow up on kind of the thrust of Ann and David's questioning. Does your intelligence, like what you know and see today and hear, does that give you a sense that by the end of the second quarter, you'll be able to give us more, whatever it is, like a clearer view of what the rest of the year looks like and how things play out?
53;Q&A;Preston Feight - CEO;Firm;I think, as a general sense, it seems like by the next quarter gets through us, we'll have a lot more information than we do today and we'll share with you what we can at that point.
54;Q&A;Joel Tiss - BMO;Analyst;And then, I wonder if you could give us a little bit of a sense like you're kind of hinting at flexibility in the factories and every time you walk through, there's fewer and fewer people or there's more automation, whatever the right way to say it is. Can you give us a sense of some of the internal focus points? You guys are kind of using this pandemic as an opportunity to come out of this situation stronger over the next 5 or 10 years than you were going into it?
55;Q&A;Preston Feight - CEO;Firm;Well, I think, what I look at is first -- the first thing that comes to my mind is when we go to our factories, when I go to our factories, I meet with our people, whether it's in a distribution center or a truck factory or anywhere, it's just how impressive they are. And we have such an incredible group of people and they're just exceptional, they're just exceptional people. I'm so proud of them and what they're doing. So, they're the ones that are everyday thinking of new ways to optimize our efficiencies and effectiveness and they do it every day. And they continue in that vein. And we Six Sigma as a great tool for ourselves and optimizing and we'll continue doing that. This is accretive time for us as we look at truck production and how we come back. And we'll learn some new things and they'll be helpful to improving the business and making us even more effective and efficient as we look forward.
56;Q&A;Joel Tiss - BMO;Analyst;Your employees are going to make a recording of this and come back to you and ask for a raise next January. Thanks very much.
57;Q&A;Preston Feight - CEO;Firm;They are the best in the world. They are fantastic.
58;Q&A;Operator;Operator;Your next question comes from the line of David Leiker of Baird.
59;Q&A;David Leiker - Baird;Analyst;I want to try and dig through a little bit of kind of the segments within the trucking space and your customers. I mean, there are some parts that are strong, consumer focus, package delivery focus. There are some that are really weak, energy and auto related. Could you talk a little bit about that customer mix for you, for your products, and how that would compare to the industry overall in general?
60;Q&A;Preston Feight - CEO;Firm;Sure. You did a good job of summarizing what's really going on as if you look at refrigerated carriers or protein haulers. They obviously have just seen a shift in where their business is going. So, those long-haul trucking companies that are delivering that are doing well. Vocational segment is where we're a market leader -- the market leader. And that business has been strong. And I mentioned that part of our inventory is at bodybuilders right now. So, that inventory is being built, being ready for production for a summer season. And I think, as you look at some of the over the road trucking companies, it varies by company. Talking with some of them, they have a good base of customers. And those that have a good base of customers, they're will really well positioned. And there, as you said, the energy sector has been lower but the yin to that yang is that fuel prices are down 20%. And if fuel prices are one third of the operating costs for a trucking company, then that's helping them from their operating models as well. So, that's kind of you -- you characterized it well. And that's a little bit more information on it.
61;Q&A;Operator;Operator;Your next question comes from the line of Ross Gilardi of Bank of America. Your line is open.
62;Q&A;Ross Gilardi - of America;Analyst;Good morning, guys.
63;Q&A;Preston Feight - CEO;Firm;Good morning, Ross.
64;Q&A;Ross Gilardi - of America;Analyst;I have two questions. First on the PDCs and the two additional ones that you're going to add. Can you quantify at all how big of a global increase in parts footprint that this will represent when you open them? And do you worry at all about adding parts distribution capacity in the middle of a recession? And I'm trying to just get at like how many -- you guys have added a lot of distribution centers over the last 5 to 10 years, and granted, that markets not going to move like -- is volatile as the overall truck cycle. But, if we're in a slower economy for a longer period of time, do you bump up and will limit some point as to how much you can continue to expand that that distribution network?
65;Q&A;Preston Feight - CEO;Firm;Sure. We have 18 distribution centers, we'll be adding two more that was down in Las Vegas facility a couple of weeks ago, new one, it's just beautiful. And I know the employees are excited to move in there as we're talking about it. I think, one of the things that's happening is there's always opportunity to gain share. And we continue to use those distribution centers and the best practices around them to gain share. For example, our distribution centers are more closely aligned to our dealer body, then we're able to deliver more overnight parts to our customers and keep their uptime at maximum levels, which is one of our key objectives. That gives us a competitive advantage against the market. So, that's part of the thinking. It's not just about parts and storing, it's about getting them to the customers as quickly as possible, and that's been really successful for us and helping the parts team grow the business.
66;Q&A;Ross Gilardi - of America;Analyst;Okay. So, is it fair -- are they all fairly similar in size? If you're adding to on a network of 18, is this sort of like a 10% increase? And will the business benefit from just some type of pipeline fill in the -- I don't know if that'd be a second quarter event or a second half event that will help continue to support the top-line for the parts business this year?
67;Q&A;Preston Feight - CEO;Firm;So, you're right in saying it will continue to support the top line growth of the business. And yes, roughly 10%. There is some variation in the size of the PDCs, but they're roughly the right order, same orders of magnitude.
68;Q&A;Ross Gilardi - of America;Analyst;Okay, got you. And then just lastly, can you quantify your energy exposure? I realized that it's tricky. But maybe at the very least, you could you could tell us what portion of your U.S. and Canadian dealer network is located in the Gulf region or other energy-dependent regions? And anything like that would be really useful.
69;Q&A;Preston Feight - CEO;Firm;Yes. We have a very diversified portfolio. It's not concentrated overly in the energy sector. So, the dealers that have -- there are some dealers that obviously have more exposure. But, our dealers are doing just such a great job of building their businesses that they have good absorption, good parts and service businesses throughout diversified customer bases, even for themselves. And so, dealer body is in really good shape and managing that well.
70;Q&A;Ross Gilardi - of America;Analyst;Okay, thanks.
71;Q&A;Preston Feight - CEO;Firm;You bet.
72;Q&A;Operator;Operator;Your next question comes from the line of Jamie Cook of Credit Suisse. Your line is open.
73;Q&A;Jamie Cook - Credit Suisse;Analyst;Hi. Good morning. And I'm glad everyone is healthy and okay in this environment. I guess, just two questions. One, can you just talk to, like on the truck side in Europe and in the U.S., like what you're hearing from your customers in terms of trends in April. And I understand that you don't want to give an industry forecast, but what your customers are sort of telling you, how they're thinking about the year because that would imply you're probably managing your business for that for whatever they're telling you? And then, I guess, just my second question, understanding your taking initiatives to cut R&D and CapEx, but how do you think sort of the coronavirus impacts people's view around alternative technologies, like EV or fuel cell relative to diesel, in particular with diesel prices lower now, perhaps we focus more on economics. So, if you could help give color on that that would be helpful.
74;Q&A;Preston Feight - CEO;Firm;Yes, sure. Good to talk to you, Jamie. I'd say from a customer standpoint, we do talk to a lot of our customers and the dealers and keep track of what's going on. And there is -- as we said before, some segments are doing well and some are experiencing moderate slowdowns. And that's to be expected in a situation with this much dynamic factoring going into it. But, it's got a good customer base and they do a good job managing their business. So, they're making the adjustments. And if there's some trucks that are not as fully utilized, that's true. But, I'm pretty impressed with how they talk about their business and their customer base. And again, they're an essential part of our economy and they will continue to move freight and are continuing to move freight. So, that's pretty important to keep perspective on. From a tech standpoint and R&D and CapEx alignment to that, when I look at that and say, you have some really neat programs going on and we're continuing on some of the exciting programs that we have within our portfolios, and some of those are R&D related. So, whether that's battery electric vehicles or work that we're doing, that work's going to continue. We're going to keep moving along and doing the critical things that are going to build a bright future for our Company and provide our customers the lowest operating cost possible. So, it's kind of a bit of a look at what's going on.
75;Q&A;Operator;Operator;Your next question comes from the line of Steven Fisher of UBS.
76;Q&A;Steven Fisher - UBS;Analyst;You guys called out some nice market share gains across the regions. What is your order share in backlog, tell you about what your market share of retail and production might be over the next few quarters, and are there any regional differences?
77;Q&A;Preston Feight - CEO;Firm;"Well, I think, we have seen good market share gains, as we mentioned, the 30.4% in the U.S. and 16.7% in Europe and really strong 8.7% in Brazil; and in the medium duty side also good growth in both Europe and North America. So, that's been good. And as far as what order intake has been, I think the last month we have numbers for we had was March and we had 38% of the order intake in the month of March. We're in a good position."
78;Q&A;Harrie Schippers - President and CFO;Firm;Some more color on Europe. I think the market share growth to 16.7% for DAF has been in most markets, especially the UK. The UK, share in the first quarter grown to 35%. So, we're really benefiting from the fact that we have an excellent factory in Leyland and are able to build our trucks for the UK, in the UK.
79;Q&A;Steven Fisher - UBS;Analyst;Okay. And then, you have some plans to open up some international used truck centers. How much better do you expected the used margins to be at these company-owned retail centers versus any other used sales channels that are out there?
80;Q&A;Harrie Schippers - President and CFO;Firm;Those used truck centers, one of the benefits that we have is that they predominantly sell to retail customers. And the margins we make when we sell a used truck to a diesel customer are significantly higher than selling them to wholesalers or other customers. So, those used truck centers really give us a very nice return on our investment there.
81;Q&A;Operator;Operator;Your next question comes from the line of Seth Weber of RBC Capital Markets.
82;Q&A;Seth Weber - RBC Capital Markets;Analyst;Actually I wanted to follow up on Steve's last question on the used sales mix. Is there any color you can provide on sort of where you see the channel mix works today, where you think it's going as far as retail versus wholesale or auction, anything that we can kind of use to frame what the opportunity there is to get the margins up?
83;Q&A;Preston Feight - CEO;Firm;What I look at is, the PACCAR Financial team has done a really good job of building this used truck center network and we've seen even in the U.S. uptick in the recent time of more retail activity flowing through the used truck centers. And as we build like the one in Prague and expand our capabilities, that just creates an outlet for the strong customer demand for PACCAR products and the used market. And it gives them a good place to go to get a young truck that's going to serve their needs really well and they're happy to buy those trucks from us, because they know what they're getting. That helps values.
84;Q&A;Seth Weber - RBC Capital Markets;Analyst;And then, sorry, if I missed this. But, have you talked to just the new truck pricing environment? I think, last quarter, you said it was up about 2%. I'm just wondering, if anything has changed given the macro and also the weakness in used pricing. If anybody -- if any of your competitors are doing anything irrational, or is that you still seeing positive pricing on the new truck side? Thanks.
85;Q&A;Preston Feight - CEO;Firm;Well, I'll let you talk to the competitors and what they do that's irrational. But for us, what we see is steadiness in pricing. And I think there continues to be a strong desire to have the best trucks, which are Kenworth, Peterbilt and DAF.
86;Q&A;Operator;Operator;Your next question comes from the line of Courtney Yakavonis from Morgan Stanley. Your line is open.
87;Q&A;Courtney Yakavonis - Morgan Stanley;Analyst;I was wondering if you could just share with us a little bit more detail on how to think about some of the fixed costs associated with the plant shutdowns and then also with the plant reopenings. And if any of the protocols that you're enacting that could last for a bit longer might impact the cost basis over the next 12 to 18 months?
88;Q&A;Preston Feight - CEO;Firm;Sure. As far as the protocols we're implementing, come back to the statement, because it's core to us. Our biggest focus right now is making sure that our employees are cared for and operating in healthy and safe environment. And so, those protocols, things like temperature testing, when they enter the facilities and making sure there's 6 feet between them or 1.5 meters in Europe that we have put up spacing and barriers, where we're building the trucks. The people are wearing masks that we're doing great cleaning and that we're comparing all of our practices that I just described to other industry leaders to make sure we have the best practices in place. Those will carry on as long as they need to make sure that our employees are healthy and protected. And they're involved in the process and want them to feel comfortable with their environments. And that's really important to us. And then, as far as the costs that we experienced. We're -- Company is always thinking about capital costs and expense costs and looking for ways to reduce them. And our teams are fully focused on that. That's why you see the reduction in the CapEx spending plans that we outlined in our opening comments, and why we are looking at R&D reductions that we can take, just so that business is optimized and set up for this industry cycle.
89;Q&A;Courtney Yakavonis - Morgan Stanley;Analyst;Is there anything you could share with us, just maybe about factory overhead costs that might not be getting cut just for the week that you're shut down? And then, if there's any difference between the shutdowns in North America versus in Europe?
90;Q&A;Preston Feight - CEO;Firm;Yes. The difference is that we have furloughs from employees during the stopping point. And that's what we've done in North America and Europe. In the Netherlands, the good relationship with our unions there and with our employees there and with the government there, and they've been able to help us support people still working during the shutdown, the overhead side of the business. And that's great, because we're continuing to make progress in these practices to keep a healthy and safe environment, and even on the engineering side, they are continuing to work on new projects and processes that are aligned with government support programs.
91;Q&A;Harrie Schippers - President and CFO;Firm;And those support programs are in place, not only in the Netherlands, but also in Belgium and UK and qualifies to all those programs.
92;Q&A;Courtney Yakavonis - Morgan Stanley;Analyst;And then, just lastly, your parts margins did hold up very well this quarter. You mentioned that you've been building out the e-commerce platform, but are you seeing any structural changes that you think might last in terms of how your customers are interacting with that business in this environment?
93;Q&A;Preston Feight - CEO;Firm;I think that -- I think this may hasten the move towards more and more e-commerce in the parts business. And our team has built a great system to make that available for the customers, for the dealers to work with, and we continue to use the e-commerce, MDI systems to help everybody have the right parts at the right places at the right time, so that we can make sure our customers' uptime is optimized. There may be a little bit of a move towards that furthering. And that's good for PACCAR and good for our parts team.
94;Q&A;Courtney Yakavonis - Morgan Stanley;Analyst;Great. Thanks.
95;Q&A;Preston Feight - CEO;Firm;You bet.
96;Q&A;Operator;Operator;Your next question comes from the line of Matt Elkott of Cowen. Your line is open.
97;Q&A;Matt Elkott - Cowen;Analyst;Good morning and thank you. So, the truckload industry, which is an important part of your customer base, had been dealing with some headwinds like rising insurance premiums and low freight rates, which was resulting in a lot of market exits. But now, they also have the tailwind of lower diesel prices. So, my question is, if we start to see an economic rebound, while at the same time oil prices lag and remain relatively low, which would be good for the health of the truckload industry, do you have any sense of how quickly that could translate into higher orders and how we could see a benefit from that?
98;Q&A;Preston Feight - CEO;Firm;That's a good commentary you offered. I think it's a truth of the confluence of the pandemic and the low oil prices and the fact that customers continue -- our customers, trucking companies continue to deliver freight. And when they're delivering freight, they're putting miles on trucks. And so, that bodes well for us in the future because they're consumable and over time will need to replace them.
99;Q&A;Matt Elkott - Cowen;Analyst;That makes sense. And then, just one follow-up on the balance sheet side. You don't have manufacturing debt, but you do obviously go to debt markets in your financial services segment. If this economic crisis intensifies and morphs into our financial crisis, do you think you may have to borrow on your manufacturing segment for your financial services segment?
100;Q&A;Harrie Schippers - President and CFO;Firm;So, you're right. PACCAR has a very strong balance sheet with a $4.3 billion in cash, a strong A+/A1 credit rating and no manufacturing debt. And that is exactly how we like it.
101;Q&A;Preston Feight - CEO;Firm;And we've had good access to the markets, we do. We have great credit ratings and good access to the markets. And we've had no trouble in getting midterm notes and our issuances in the first quarter were $632 million. And we did an issuance in April for $400 million. And we've got really good position to support our financial services business.
102;Q&A;Operator;Operator;Your next question comes from the line of Felix Boeschen of Raymond James.
103;Q&A;Felix Boeschen - Raymond James;Analyst;I really just have a quick question around how to think about the Parts business going forward. I think, obviously Trucks still moving as a positive for the business. But outside of looking at industry truck utilization, was there anything we should think about around the strong 1Q performance in that business, dealers building parts inventory, given some uncertainty ahead or any color in the way you think inventory levels might be today?
104;Q&A;Preston Feight - CEO;Firm;Sure. I think that the most significant factor is the team at PACCAR Parts has done a great job with -- alongside of our dealers with having the right kind of systems in place to support the customers. And so, they become a go to organization in these times. And they're doing a great job of meeting the demand there. And I think that there -- obviously, as the situation is dynamic, people were looking at that. And so, they want to make sure that part is on the shelf to take care of the customers. They've done that. And as we move forward, they're consuming those parts and they'll reorder.
105;Q&A;Operator;Operator;Your next question comes from the line of I shouldn't mention the line of Faheem Sabeiha of Longbow Research. Your line is open.
106;Q&A;Faheem Sabeiha - Longbow Research;Analyst;Just for starters. As far as the social distancing and the staggered shifts that you guys are employing in the factories, would that have any impact on production capacity?
107;Q&A;Preston Feight - CEO;Firm;Excuse me. What was the last part?
108;Q&A;Faheem Sabeiha - Longbow Research;Analyst;Would that have any impact on production capacity?
109;Q&A;Preston Feight - CEO;Firm;I think that we always -- we think that in the market we're in we have sufficient capacity. And even bringing in these great best practices will have a sufficient capacity to build for our customers' needs.
110;Q&A;Faheem Sabeiha - Longbow Research;Analyst;Okay. And can you provide some color around the order intake and cancellations that you've been seeing so far at least through April? I just want to understand if your backlog is essentially holding or shrinking at this point?
111;Q&A;Preston Feight - CEO;Firm;Yes. I think that through the month of April, our backlog actually improved and increased because we weren't building trucks. And so, we do have good backlog through the second quarter and we'll watch how that carries on.
112;Q&A;Operator;Operator;Your next question comes from the line of Rob Wertheimer of Melius Research.
113;Q&A;Rob Wertheimer - Melius Research;Analyst;My question is just on your visibility into any future supply chain disruption from all the obvious impacts. Does that feel like a major uncertainty still, or is your visibility in the supply chain and how your suppliers are working seeing less volatile and less of a disruptive risk?
114;Q&A;Preston Feight - CEO;Firm;We're working really close with all suppliers, have daily contact with them. And we have great strong supply base. We choose them for their strength and continue just alignment with them so that when we restart, they're ready to go, and align with us, being ready to go. So, there are daily conversations. There's nothing that seems unstable right now. It's just making sure they've put the best practices in, care for their people, which they want to do and align up with the government directives.
115;Q&A;Rob Wertheimer - Melius Research;Analyst;And you've made a number of helpful comments on parts? Are you able to say from telematics or otherwise, how far miles driven or down in April just to give a sense of real time pulse of the economy?
