;section;speaker;role;text
54;Q&A;Preston Feight - CEO;Firm;Yes, I think what we're always looking for in those in SG&A, and in our spending is to make sure that we are developing the right products and services for customers looking into the future. And so as we shared, we think the level of spending for us on R&D and capital our capital come down a little bit. R&D is roughly flat, and I think in SG&A, we will apply rigorous disciplines, to make sure that the costs are appropriately controlled.
55;Q&A;Ross Gilardi - Bank of America;Analyst;And is that just from flexing the workforce, or what are the other -- is that the main source of savings, if -- when you get to that point?
56;Q&A;Preston Feight - CEO;Firm;Workforce is one, contracts is another, licensing agreements, work we do, those kinds of things, all get looked at. We really don't think of things in terms of a lot of fixed pricing.
57;Q&A;Harrie Schippers - President & CFO;Firm;We go through our overhead budgeting process every year, as a zero based budgeting process, and we review all necessary spending in detail and make sure that we're keeping our organization as lean as possible.
58;Q&A;Ross Gilardi - Bank of America;Analyst;And then can you just remind us the percentage of your European deliveries that come from the U.K.? I seem to remember, it's around 20%, is that in the right ballpark? And can you remind us what portion of Leyland's capacity sold to the U.K. market versus the European Union? I mean on that note, could you shift production out of the U.K. to DAF in the Netherlands to serve Europe, if we did go through a hard Brexit?
59;Q&A;Preston Feight - CEO;Firm;So I as we think about the U.K. one of the beautiful things for us is, we have great production capacity in the U.K. We also have it in Eindhoven, and so we were able to flex depending on what Brexit might or might not be appropriately for the market, so we can build the trucks we need in the U.K., in U.K., and we can build all the trucks, the CFXs we need for the continent, we can build on the continent as well. So that gives us good flexibility, and I think Harrie, you were looking at the number...
60;Q&A;Harrie Schippers - President & CFO;Firm;The U.K. typically is between 15% and 20% of our European production.
61;Q&A;Ross Gilardi - Bank of America;Analyst;So most of the existing production, at least for a year like this year, would just be -- would be for the U.K. market out of the U.K. factory?
62;Q&A;Preston Feight - CEO;Firm;Yes, that's -- we can use it for both, and we have enough there to support the U.K. and we have enough capacity in Europe to support Europe.
63;Q&A;Harrie Schippers - President & CFO;Firm;And being the only truck manufacturer that has a factory in the U.K., that could give us a very nice advantage.
64;Q&A;Operator;Operator;Our next question comes from Jamie Cook from Credit Suisse. Your line is now open.
65;Q&A;Jamie Cook - Credit Suisse;Analyst;I guess one question, as you're thinking about the commentary that you made about decrementals of the 15% to 20% or so, are there any variances or differences as we think about where the weakness is coming from, are the decrementals dissimilar and the U.S. and Europe are not so much anymore with being more vertically integrated the U.S. now. And then I guess my second question regards to -- relates to sort of price costs. Obviously pricing has been pretty strong for you guys this year, and the downturn that you guys are forecasting, do you think you can hold sort of price in that material cost could potentially be a tailwind for you? Thank you.
66;Q&A;Preston Feight - CEO;Firm;Yes, I think it will be -- your second part of question is quite possibly true, and we'll continue to manage price to best of our ability in the market, and we are always aggressively looking at our cost structure. And, as you mentioned, that could be a bit of a tailwind for us, in terms of what happens next year, as in 2019, suppliers are running at full capacity, some inefficiencies in their ships. So maybe there's some upside in that.
67;Q&A;Jamie Cook - Credit Suisse;Analyst;And just the first part, difference U.S. versus Europe in terms of impact on margins?
68;Q&A;Preston Feight - CEO;Firm;Yes, they're very similar, very similar.
69;Q&A;Operator;Operator;Our next question comes from Courtney Yakavonis with Morgan Stanley. Your line is now open.
70;Q&A;Courtney Yakavonis - Morgan Stanley;Analyst;I just wanted to go back to the clarification on the comments on your build rate being appropriate for the orders you have right now in the backlog for the first quarter. So is your assumption then that -- at the beginning of 2020, that we should return to that kind of replacement rate of 20,000 orders a month? Or is your current build rate kind of assuming, that we remain at this sub-15,000 orders, and the backlog can fill in the rest. And then also just wanted to make sure that the comment was, that the September build rate is the right assumption we should have, going forward?
71;Q&A;Preston Feight - CEO;Firm;Well, we've made adjustments in the first parts of October for our build rates, so this is coming at that. So we think we've got that set up right. When I think about our backlog and build rates for next year, we still have quite a healthy backlog, and so there could be a little bit of a more time for the normalization to that quarter intake of 20,000 per month, as you put the number out there. But orders are definitely starting to pick up. It's a very normal part of the cycle to have late summer be quiet, and then as people are putting their capital budgets into place, then to see the fourth quarter be a time of ordering, and we're seeing that right now. So whether it's going to be exactly at level this month or it will take a month or two to normalize out, it should normalize out.
72;Q&A;Courtney Yakavonis - Morgan Stanley;Analyst;But it sounds like before the beginning of the year, you do expect that return. And then just on CapEx and R&D, you gave us guidance for 2020 and I think there's a bit of a step-down in CapEx versus '19 but still an elevated level, relative to what's historically seen out of you guys. So is that kind of the right run rate that we should be thinking about, the investments that you're -- that the business kind of needs at this point, or a lot of those one-time in nature? And then kind of same question on R&D, which is expecting to pick up, and especially in light of concerns about decrementals next year. Are there any buckets in R&D that potentially could be factored in as well.
73;Q&A;Preston Feight - CEO;Firm;Sure. For both of them as far as -- whether they're one-time or continuous run rates, what we do is, we always look at the portfolio of projects and opportunities that are going to bring value, and we invest in those. We build the business for the long haul. Don't think about the quarterly cycle as much as we do, is making the right level of investments, and we have -- that's how we've arrived at the number, and the guidance number, at $625 million to $675 million in CapEx. And the same approach is on R&D, which is not a lot of really good projects out there right now, that have great ROIs for our customers. And so we're looking at those and always evaluating whether they should be done and whether you can bring the right value and the portfolio we have is, it's a fantastic portfolio, both for factory improvements, and one of the ones we mentioned, is the Chillicothe new paint facility, which will improve efficiencies and quality, just as an example. And as we look at the R&D spending kinds of projects on powertrains, and we mentioned electric vehicles and autonomous vehicles and more aerodynamic truck models, improvements, all of those are things that we look at and say, hey, if we can do this, and it's going to make our already best in class trucks even better, then we're going to do them.
74;Q&A;Courtney Yakavonis - Morgan Stanley;Analyst;And then just lastly, I think last quarter you called out some customer mix headwinds. Obviously, we saw an improvement in margins this quarter, part of that was just stockings from the headwinds from last quarter. But were there any customer mix changes this quarter that we should be thinking about, kind of for the remainder of the year?
75;Q&A;Preston Feight - CEO;Firm;So I think we already kind of talked about North America being a positive for us in the quarter. And I think that's really the only minor thing that was -- I would say it was a contributor. But overall, good pricing, good cost control and a stronger North American mix.
76;Q&A;Operator;Operator;Our next question comes from Adam Uhlman with Cleveland Research. Your line is now open.
77;Q&A;Adam Uhlman - Cleveland Research;Analyst;I wanted to start with a clarification of the fourth quarter production being down 6% to 8% sequentially. Could you break that out between your plans for North America and Europe?
78;Q&A;Preston Feight - CEO;Firm;So I think they're fairly comparable without running exact numbers. They are both roughly in the same ranges in the quarterly, look at how they how they moved about high-single digits in North America, and it was a series of smaller steps through Europe, that did the same thing.
79;Q&A;Adam Uhlman - Cleveland Research;Analyst;And then, I'm wondering what your view is on medium-duty truck markets next year in North America and then also your thoughts on Europe as well?
80;Q&A;Preston Feight - CEO;Firm;So for the medium-duty market in North America, I think we're seeing, it's around 100,000 in North America and right around 50,000 in Europe for next year. So, comparable numbers for this year.
81;Q&A;Adam Uhlman - Cleveland Research;Analyst;And then just back to Europe. I'm wondering if you would be willing to share with us, the magnitude of the order declines that you did see in that region, and do you get the sense that order rates are bottoming out now, if we start to see a leveling out of that pace of decline, or is that maybe still too early?
82;Q&A;Preston Feight - CEO;Firm;It what we're really trying to look at, is what's going on with the cycle and what's going on with the timing of the calendar year, and in fact of recent, we've seen an improving order intake in Europe, actually it's matching up to our build, so that's been a nice balancing point. And hopefully that will be what continues.
83;Q&A;Adam Uhlman - Cleveland Research;Analyst;Is there any particular region or part of the continent that saw a nice improvement?
84;Q&A;Preston Feight - CEO;Firm;Got to believe it has something to do with providing great trucks to our customers, and I think that really is a big part of it at the end of the day, because I think that we've been able to get to our record market shares in Europe and hold on to that share because people are experiencing our fantastic trucks and want some more of those.
85;Q&A;Operator;Operator;Our next question comes from David Raso with Evercore ISI. Your line is now open.
86;Q&A;David Raso - Evercore ISI;Analyst;I was impressed with the parts outlook for next year. Can you give us a little more comfort on your visibility to project that kind of parts growth for next year? I know you have some help from the aging of the engines, hitting a sweet spot. But can you help us get a little more comfort with that stronger growth?
87;Q&A;Preston Feight - CEO;Firm;Yes, sure. I think that strong growth is a result of, as you said the engines. It's also this investment in TRP that we're doing. Our team there does a fantastic job in e-commerce and in reaching out to our customers through new ways that are meeting their needs. So we're able to just kind of keep taking more and more of the market. These investments in our PDCs that we mentioned, both in Ponta Grossa in Brazil and in Las Vegas, allow us to get parts to the customers more quickly in those regions, which makes us a more desirable provider. And really frankly in partnership with our dealerships, who are fully committed to growing their parts business, because it's good for them, good for our customers and good for us, it's one of those real opportunities for win-win-win.
88;Q&A;David Raso - Evercore ISI;Analyst;Are there any metrics of any kind though that you for backlog of some kind or some parts -- percent of the parts business that has some sort of annual contract?
89;Q&A;Preston Feight - CEO;Firm;Yes. Parts don't really work out that kind of a long backlog, it's much more of a...
90;Q&A;David Raso - Evercore ISI;Analyst;I appreciate that. But just any anything you're looking at, that might give us some more comfort on the number?
91;Q&A;Preston Feight - CEO;Firm;Well, I think the comfort should come from the historically strong performance and then the reasons that we just talked about, which are just a lot of great products, growing relation of PACCAR products in Europe and North America over the past several years and that has also contributed to that growth and will continue to contribute to that growth, and some strong markets that we have a large part of trucks out there.
92;Q&A;David Raso - Evercore ISI;Analyst;And last, the European business, the leasing of trucks, can you help us a little bit, well you said there was less of it in this quarter, sort of, what are you seeing on that front for the mix going into next year?
93;Q&A;Preston Feight - CEO;Firm;Missed the first part of your question on this side, can you say it again David?
94;Q&A;David Raso - Evercore ISI;Analyst;For the European business, the mix of businesses where there are some buyback guarantees and the leasing of the business, how you represent to the revenues, it impacted the price per unit delivery this quarter. Can you just help us take us through your thoughts on '20, on the mix for that into next year?
95;Q&A;Preston Feight - CEO;Firm;I think it's probably going to run a lot like this '19 has gone. Those adjustments were more '19 to '18 than they were looking forward. So we're at a pretty stable rate of optional and fixed rate GRVs.
96;Q&A;Operator;Operator;Our next question comes from Jeff Kauffman with Loop Capital Markets. Your line is now open.
97;Q&A;Jeff Kauffman - Loop Capital Markets;Analyst;A lot of my questions have been answered. I wanted to focus a little bit on tax rate, if that's okay. It looks like the tax rate outlook had come down a little bit, and maybe I'm not thinking about it right, I would have thought more North American exposure would have driven it higher? Am I wrong, does it drive it lower, and is that kind of a lower level of taxes that we should be thinking about for the rest of this year?
98;Q&A;Harrie Schippers - President & CFO;Firm;The tax rate normally -- you should think about is a 23% level. We benefited in Q3 from higher R&D credits than originally anticipated. So those are our final returns.
99;Q&A;Jeff Kauffman - Loop Capital Markets;Analyst;So should I carry that through to the end of the year, or is it more of a third quarter thing?
100;Q&A;Harrie Schippers - President & CFO;Firm;Well, I think you should think in terms of 23% for Q4 and for 2020.
101;Q&A;David Raso - Evercore ISI;Analyst;And as I look to -- okay. You said for 2020. That's my question, all my others have been answered. Thank you.
102;Q&A;Operator;Operator;Our next question comes from Joe O'Dea with Vertical Research. Your line is now open.
103;Q&A;Joe O'Dea - Vertical Research;Analyst;In U.S. and Canada, it looks like Class 6, 7 growth was pretty healthy in the quarter, and better than the market, and so curious, whether that's just sort of time...
104;Q&A;Preston Feight - CEO;Firm;Joe, are you still there?
105;Q&A;Ken Hastings - Director of IR;Firm;Lindsay, are you there?
106;Q&A;Operator;Operator;Yes, I am showing that Joe is still connected.
107;Q&A;Preston Feight - CEO;Firm;Well, I guess, we'll just -- we aren't hearing from you, we will just kind of try to extrapolate your question a little bit.
108;Q&A;Ken Hastings - Director of IR;Firm;Or we could move on and maybe Joe can rejoin.
109;Q&A;Operator;Operator;Our next question comes from Neil Frohnapple with Buckingham Research. Your line is now open.
110;Q&A;Neil Frohnapple - Buckingham Research;Analyst;I believe PACCAR's market share historically tends to be counter-cyclical. I mean is there any reason to think that your market share wouldn't be higher in 2020, and your production wouldn't outperform the industry? I guess I'm just asking the production question a little differently.
111;Q&A;Preston Feight - CEO;Firm;Sure. I think, the trucks are performing exceptionally well in the field. I think our customers are experiencing that we're delivering the best fuel economy, and the lowest operating cost of any brand. So we do think that should drive our market share up, and looking forward to that happening, and working every day to make sure that does happen.
112;Q&A;Neil Frohnapple - Buckingham Research;Analyst;And then just going back to the parts sales growth outlook for next year, 4% to 6%. I'm presuming that the lower outlook, I guess relative to the 8% part segment CAGR that you talked about at the Investor Day, is more due to just fleets pulling back on spending and purchasing obviously a lot less trucks next year. So I guess, at what point do you think that growth rate can start to reaccelerate, in order for you guys to hit those long-term targets?
113;Q&A;Preston Feight - CEO;Firm;Yes, I think that the 4% to 6% number is a nice steady growth rate in a market that's declining, as depending on what happens. And again, I think that there's a lot of things working right to it, as far as when it come back up. We'll keep our eyes on that, and watching for every opportunity to grow it.
114;Q&A;Operator;Operator;Our next question comes from Robert Salmon with Wolfe Research. Your line is now open.
115;Q&A;Robert Salmon - Wolfe Research;Analyst;Could you give a little clarification on the used truck outlook, it sounded like in the third quarter, it was down 10% to 15%, is that what you guys are contemplating looking out, or are you contemplating kind of a similar absolute level of used truck sales, from a price perspective?
116;Q&A;Preston Feight - CEO;Firm;Yes, I think that down amount that we've seen, maybe that will continue. It's obviously difficult to forecast entirely where it will stay settled out to. But...
117;Q&A;Harrie Schippers - President & CFO;Firm;It could stay around for the next couple of quarters.
118;Q&A;Preston Feight - CEO;Firm;And I think you know the thing we're looking at is just that there is -- there is still a really healthy demand out there for day cabs specifically, and although values are down, we have the advantage of PACCAR of having a mix of trucks. We are not very uniform in our truck distribution. A lot of day cabs, a lot of pickup and delivery, a lot of vocational trucks, and some sleeper trucks as well. So I think our ability to move those trucks should at least perform to the market and probably outperform, and again, we'll keep getting the premium for those trucks.
119;Q&A;Robert Salmon - Wolfe Research;Analyst;And as I look at the gross margin outlook for the fourth quarter, can you give an update on what the price cost spread was in the third quarter? And then, looking out to the fourth quarter, if there are any sort of different assumptions you have built in there, just to get a sense of what sort of decrementals you guys are kind of thinking about in production, versus a different price cost mix?
120;Q&A;Preston Feight - CEO;Firm;And so, in the third quarter, we saw a price of roughly 3% and cost of 1.5%. And I think in the fourth quarter, I think there will be more pricing pressure, but there could be some opportunity on costs, that we're evaluating right now.
121;Q&A;Robert Salmon - Wolfe Research;Analyst;And would you expect the cost opportunity to kind of continue, should it step up in 2020, relative to your experience in the fourth quarter? Or are you kind of thinking about something similar?
122;Q&A;Preston Feight - CEO;Firm;I think it might be hard to guess out to what is going to be in 2020 right now.
123;Q&A;Operator;Operator;Our next question comes from Shawn Kim with Gabelli Funds. Your line is now open.
124;Q&A;Shawn Kim - Gabelli Funds;Analyst;Just wanted to follow up on the parts business. I think at your Investor Day, you mentioned -- you guys expect to have 450,000 MX engines in service by 2024. But I guess, said another way, I mean is that the right way to look about your total addressable market for the parts business in the mid 2020s? So if -- I think the active U.S. Class 8 population is about 2.2 million trucks. I guess, out of that 2.2 million figure, what's the opportunity for you guys long-term regarding servicing those trucks on the road?
125;Q&A;Preston Feight - CEO;Firm;So I think about it in a couple of different ways. One is, that you mentioned is, the growing MX park that's out there, we did add capacity to our Columbus engine plant, and increase our build rates of MX engines. In fact, in the second -- in the first half, I think we were 39% MX, and in the third quarter we were 45%, so we saw some growth there and do see some continued upside for MX engines, as people get to realize the benefits of that great engine. And then I think it's not just about our park of vehicles for Kenworth and Peterbilt and DAF for the engine. I think our team does a great job of also capturing into the all-mix business with the TRP brands, where 50% of those customers are new to PACCAR, which creates a great opportunity for growth for us as well. And I think we're always looking at opportunities to grow, not just the parts business itself, but provide increased levels of service for our customers, and that comes through higher degrees of connectivity of the trucks, where we understand better what's going on. So all of those point to opportunities to keep growing the parts business over time.
126;Q&A;Operator;Operator;There are no other questions in queue at this time. Are there any additional remarks from the company?
127;Q&A;Ken Hastings - Director of IR;Firm;Yes. We'd like to thank everyone for joining the call and thank you, operator.
128;Q&A;Operator;Operator;Ladies and gentlemen, this concludes PACCAR's earnings call. Thank you for participating. You may now disconnect.
