;section;speaker;role;text
0;scripted;Operator;Operator;Good morning and welcome to PACCAR's Third Quarter 2019 Earnings Conference Call. I would now like to introduce, Mr. Ken Hastings, PACCAR's Director of Investor Relations. Mr. Hastings, please go ahead.
1;scripted;Ken Hastings - Director of IR;Firm;"Good morning. We would like to welcome those listening by phone and those on the webcast. My name is Ken Hastings, PACCAR's, Director of Investor Relations, and joining me this morning are Preston Feight, Chief Executive Officer; Harrie Schippers, President and Chief Financial Officer; and Michael Barkley, Senior Vice President and Controller. As with prior conference calls, we ask that any members of the media on the line participate in a listen-only mode. Certain information presented today will be forward-looking and involve risks and uncertainties, including general economic and competitive conditions that may affect expected results. For additional information, please see our SEC filings and the Investor Relations page of paccar.com. I would now like to introduce Preston Feight."
2;scripted;Preston Feight - CEO;Firm;Good morning. Harrie Schippers and I will provide you an update on PACCAR's excellent third quarter results and business highlights. To begin, I'm proud of our employees around the world who provide our customers the highest quality trucks, powertrains, and transportation solutions. In the third quarter PACCAR achieved sales and financial services revenues of $6.4 billion and net income of $608 million, resulting in a strong 9.5% after-tax return on revenues. PACCAR net income increased 11% compared to the third quarter of last year. PACCAR achieved robust truck, parts, and other gross margins of 14.9% in the third quarter, and also for the year to date. Through the first nine months of the year, our team achieved record revenue and earnings. PACCAR delivered 49,300 trucks during the third quarter, compared to 52,200 in the second quarter. This reflects fewer billing days in Europe, due to DAF's regular summer shutdown, which was partially offset by higher deliveries in North America. In the fourth quarter, deliveries will be lower by 6% to 8% compared to the third quarter, due to fewer production days in North America and lower daily build rates in North America and Europe. Fourth quarter truck, parts and other gross margins are estimated to be in the range of 14% to 14.5%. PACCAR declared third quarter dividends of $0.32 per share and year-to-date dividends of $0.96 per share. Year-to-date dividends were 19% higher than dividends declared in the same period last year. We repurchased 833,000 shares of stock during the third quarter, and there is $431 million remaining in the current $500 million Board of Directors' authorization. PACCAR continues to create a full lineup of innovative truck models and technologies. Kenworth, Peterbilt and DAF have introduced a range of electric powertrain vehicles in the last two years, that customers are field testing in a variety of applications. PACCAR is well positioned to supply the industry with a complete set of powertrain technologies, including battery electric, fuel cell and diesel engines. This year, PACCAR has opened two global software research and development centers in the U.S. and Europe that are accelerating the development of embedded vehicle software, and PACCAR connected vehicle solutions for our customers. The PACCAR Innovation Center in the Silicon Valley, which we opened in 2017, complements PACCAR's extensive R&D efforts, and is focused on the development of PACCAR level 2 and 4 autonomous trucks. PACCAR will showcase many of our innovative products and technologies at the North American Commercial Vehicle Show in Atlanta next week, and at the CES Technology Show in Las Vegas in January. We hope to see you there. We are pleased to share that Kenworth, Peterbilt and PACCAR parts were each recognized as top employers for women at the Women in Trucking Annual Conference. We were honored for excellent work environment and company culture, that supports gender diversity. Harrie Schippers will now provide an update on PACCAR's truck segment, PACCAR Parts, Financial Services and investment priorities for next year.
3;scripted;Harrie Schippers - President & CFO;Firm;Thanks Preston. Our 2019 forecast, for Europe's greater than 16-tonne truck market, to be in a range of 310,000 to 320,000 units, reflecting continued modest economic growth and strong truck demand. Next year, the Eurozone and U.K. economies are expected to grow about 1%. We expect 2020 to be another good year, with the European above 16-tonne truck market in a range of 260,000 to 290,000 vehicles. The U.S. economy is growing 2.3% this year, with 50-year low unemployment, and strong consumer spending. Freight tonnage has grown 4.2% year-to-date. In the U.S. and Canada Class 8 industry retail sales continue to grow in 2019, following the strong orders and production over the last two years. We estimate 2019, U.S. and Canadian Class 8 industry retail sales to be in the range of 310,000 to 320,000 trucks. We expect 2020 to be another good economy, and estimate the U.S. and Canadian Class 8 truck markets to be in the range of 230,000 to 260,000 trucks, in line with normal replacement demand. The South American above 16-tonne truck market should be in the range of 95,000 to 105,000 trucks this year, and slightly higher in 2020. In Brazil, the above 16-tonne truck segment is projected to be in a range of 65,000 to 75,000 vehicles this year and slightly higher next year. PACCAR Parts business generated strong quarterly revenues of $1 billion. Quarterly pre-tax income was $207 million, 10% higher than the third quarter last year. Consistent investments in parts distribution capacity, customer focus programs such as fleet services and TRP Stores, and a growing number of PACCAR trucks and engines in operations, drove these results. Since 2013, DAF, Kenworth and Peterbilt dealers have opened nearly 200 TRP retail stores on six continents. The stores provide high quality TRP branded, aftermarket products and services to owners of all makes of trucks, trailers, buses and engines. PACCAR Parts is constructing two new distribution centers, that will open next year. A 250,000 square foot facility in Las Vegas, which will make efficient use of solar power and 160,000 square foot facility in Ponta Grossa, Brasil. We expect part sales to grow by 4% to 6% next year. PACCAR Financial Services earned third quarter pre-tax income of $67 million. The portfolio was a record $15.6 billion this quarter, and performed well, with low past dues. In the third quarter, industry used truck inventory increased, and used truck pricing declined. Kenworth and Peterbilt truck resale values commanded 10% to 15% premium in the market. We estimate 2019 capital spending to be in the range of $675 million to $725 million, and R&D expenses to be $325 million to $335 million. In 2020, we're planning for capital investments of $625 million to $675 million, and R&D expenses of $320 million to $350 million. These investments will continue to enhance PACCAR's truck, powertrains and transportation solutions. Thank you. We'd be pleased to answer your questions.
4;Q&A;Operator;Operator;Our first question comes from Joel Tiss with BMO. Your line is now open.
5;Q&A;Joel Tiss - BMO;Analyst;Wow, I'm not used to be in first. How is it going guys? Wow, first time for everything, I guess. So I just wondered if you could give us any sense of production levels for 2020, after mentioning, kind of -- we got a sense where the industry is going to be, and then mentioning that inventories for the industry are up a little bit? And I just wondered if you could give us any sense of where your production -- where you're thinking for 2020?
6;Q&A;Preston Feight - CEO;Firm;Sure, as we've watched the industry normalize, if you look at inventory, we really think that right now, it's not in that shape at all for us. We just have 2.4 months of inventory retail sales sitting out there, so that's a nice level. In good shape. We've already adjusted our backlog to be -- we have 36% of the backlog in the industry. So that's in good shape. And then as we look forward and think about build rates, we took adjustments into the -- end of the third quarter there, both North America and Europe to get them right for the markets, so that we feel like we've got a reasonable build going into 2020.
7;Q&A;Joel Tiss - BMO;Analyst;And can you give us any sense about the parts, margins, I could see and we can all see in 2019, the margins are up a little bit, profits growing faster than revenues. You gave us a revenue number for next year, is there enough momentum in the business and the new parts distribution centers to be able to do that again in 2020, you think?
8;Q&A;Preston Feight - CEO;Firm;I think the guidance we gave on the 4% to 6% growth, and I think margins would likely be comparable to what we saw this year.
9;Q&A;Harrie Schippers - President & CFO;Firm;In the 27% to 28% range, that's what we typically see for parts.
10;Q&A;Operator;Operator;Our next question comes from Stephen Volkmann with Jefferies. Your line is now open.
11;Q&A;Stephen Volkmann - Jefferies;Analyst;I'm not used to Joel being first either.
12;Q&A;Preston Feight - CEO;Firm;Good morning.
13;Q&A;Stephen Volkmann - Jefferies;Analyst;But maybe I'll pile on to his question a little bit. So Preston, just thank you for the comments around sort of production expectations. Is it your expectation at this point, that the production declines that you've kind of baked in for -- here in the second half of 2019, will be enough, and that you'll be able to sort of keep stable through 2020, is that the way, the plan is laid out?
14;Q&A;Preston Feight - CEO;Firm;I think we'll watch what happens in 2020. I don't think it's going to be an even year, every month will be different. I mean every quarter will be different. So we'll make sure that we adjust build rate appropriate to the orders we have. Right now we have reasonable backlog in the first quarter, especially in North America. So we feel like we've got ourselves about right and we'll watch as the year comes along, what we need to do, whether it's go up or down in build rate.
15;Q&A;Stephen Volkmann - Jefferies;Analyst;Okay, understood. And can we talk, maybe this is a Harrie question, just a little bit about the decremental margins since -- I guess it will be decremental next year. You've done a good job holding your incrementals kind of in the mid-teens, with an occasional high teens kind of number. I'm just curious as you have sort of more vertically integrated a little bit with your engine growth in the U.S. and all these parts distribution centers, etcetera. Do you think your decremental margin will also be in that kind of mid-teens level, or is there a reason to think it could be higher, because of the additional investment?
16;Q&A;Harrie Schippers - President & CFO;Firm;I think we've -- historically we've seen incremental and decremental margins in the 15% to 20% range and I would expect that to be similar for next year.
17;Q&A;Operator;Operator;Our next question comes from Andy Casey with Wells Fargo Securities. Your line is now open.
18;Q&A;Andrew Casey - Wells Fargo Securities;Analyst;A couple of questions. First on the Financial Services and this is kind of picking at it, but SG&A and provision for losses on receivables were up a little bit sequentially and year-over-year, what was driving that change, and was it due to any specific region?
19;Q&A;Preston Feight - CEO;Firm;What we saw in Financial Services, we've had really a low credit losses. We've had low past dues. The portfolio continues to perform really well. In fact, we're pretty pleased with that portfolio. The only headwind we've had in Financial Services was used trucks.
20;Q&A;Andrew Casey - Wells Fargo Securities;Analyst;And then, I just want to make sure I have this right, if I compare the truck segment performance to Q3 '18, you had a pretty beneficial gross spread between the 12% revenue increase, and the 3% volume growth. And I recall Q3 last year had some timing issues related to buyback contracts and stuff like that. Was that the difference in the revenue growth and the volume growth really driven by comps and pricing, or was there something else that occurred in the quarter?
21;Q&A;Preston Feight - CEO;Firm;Yes, if you just think about what this quarter was about, we did have reasonable pricing influence, that more than offset costs. So I think those are the things that drove our stronger margin performance for the quarter. I don't know if I've gone back in terms of kind of a bridge to the 3Q of '18 numbers and what was going on back in there. We did have fewer operating lease deferrals in Q3 of '19 versus Q3 of 2018, and therefore, that that helped our revenue a bit.
22;Q&A;Andrew Casey - Wells Fargo Securities;Analyst;And then on the used truck market in North America, you mentioned inventories are growing I think, have you started to see the price trends kind of gradually decline? Are we starting to see more double digit?
23;Q&A;Preston Feight - CEO;Firm;So if you think about used trucks, one of the things that has been nice for PACCAR, is we've made investments over the past few years to grow our used truck capability. We created a new used truck center in Los Angeles. We're in the middle of creating one in Denton, Texas, it will open in the fourth quarter. Obviously PACCAR's used trucks provide a premium value in the marketplace. So that's a nice thing for our customers, and really have a 10% to 15% premium over our competitors. And actually sometimes, more than that compared to some of the competitors. But we have seen the used truck market in general, go into that double digit level of declines on that 10% to 15% decline, and that's already been kind of dealt with through this quarter.
24;Q&A;Operator;Operator;Our next question comes from Ann Duignan with JPMorgan. Your line is now open.
25;Q&A;Ann Duignan - JPMorgan;Analyst;Yes, our data that we analyze and publish shows that while you do garner a premium in the used market, you're seeing these prices are down year-over-year just like everybody else's. So thank you for confirming that. My question is around the month of inventory at your dealer, it has been, you know 2.4 months, but that's based on a trailing 12 month -- trailing sales, which are at a peak. So isn't it inevitable, that as we go into next year, those months of supply at the dealers are going to expand, and you're going to have to cut production. So could you just talk about that, and why you wouldn't have to under-produce retail sales going into next year, despite the fact that you got higher backlog?
26;Q&A;Preston Feight - CEO;Firm;Well, I think -- maybe that's a little bit less than I would think about it. And I think we feel like the inventory, while you admit it, while you acknowledge is trailing run rate. We still do talk to our dealers all the time and our customers all the time, and we see that there will be good demand for the products, as we look forward. So I would say that, the last quarter's order intake has been lower, but as we get into the fourth quarter and we're meeting with customers, talking about what next year's buying pattern is going to be, I expect people will be buying trucks, and I think that indeed the occasional market seems to continue to be very solid throughout the country, throughout Canada. So I would expect that our inventory is okay. As far as adjustments go to production, like we said earlier, I think we make those adjustments up and down, as the market demands it.
27;Q&A;Ann Duignan - JPMorgan;Analyst;Yes, that's for sure. And then just based on your guide's history. I know the truck cycles over the long term and a lot of them have been manmade. But if we're going into a decline in 2020, for whatever reason, have we ever seen a cycle that's on a one year decline, or should we be bracing for a couple of years and then back to normal again. Just your perspective on that from your years of experience will be beneficial. Thanks.
28;Q&A;Preston Feight - CEO;Firm;Yes, that's a tough thing to forecast out what kind of a decline rate there would be. And if it might last longer than a year. I think we probably look at this and say, there are still strong economic fundamentals in the U.S. and Canada right now. GDP is positive, tonne miles are high. I think, we think there is normalizing of the market estimate of 230,000 to 260,000 is just -- kind of feels like where things are happening too. As far as it being beyond next year. No idea if it's just a pause in the economy, and that it will reaccelerate, or if it will slow down for more than a year.
29;Q&A;Operator;Operator;Our next question comes from David Leiker with Baird. Your line is now open.
30;Q&A;Erin Welcenbach - Baird;Analyst;This is Erin Welcenbach on for David. So my question for you is, just how firm does the backlog look from an industry perspective, and when would you expect order activity to pickup this year, if at all?
31;Q&A;Preston Feight - CEO;Firm;Sure. Well, I think that we've already done a good job of looking into our backlog and working with our customers, just to make sure that we had real backlog, and that if there were cancellations, we took them. If there were different scheduling needs, we've addressed them. I can't speak for the total industry, but I feel like -- we feel like our backlog is in a reasonable shape right now.
32;Q&A;Erin Welcenbach - Baird;Analyst;And then my second question is just, maybe if you can provide some additional color on your thoughts for Europe, and any regional variances you would expect next year, given your outlook for double digit declines in sales.
33;Q&A;Preston Feight - CEO;Firm;One of the things we've seen in Europe has been -- that the U.K. has done quite nicely for us this year. So in spite of all the news around it, and maybe that will continue. We also are the leading brand of tractors throughout Europe. And as we watch Europe really expand East -- continue to expand east in development, our DAF premium products do a great job throughout all of Europe, and we have market leadership in countries like Poland and we are strong in Hungary and Romania and those kinds of countries. So as the total market of Europe matures, DAF does very well, enables us to grow share there.
34;Q&A;Operator;Operator;Our next question comes from Jerry Revich with Goldman Sachs. Your line is now open.
35;Q&A;Benjamin Burud - Goldman Sachs;Analyst;This is Ben Burud on for Jerry. Just wanted to spend a few more minutes on Europe. So the second quarter of production adjustments in a row it seems, and it seems to be the main driver of deliveries, only increasing 3% year-over-year in the quarter. I believe your guide three months ago was 5% to 7%. So can you just spend a little more time on what drove the softness there, if that's continuing? And if you guys like to flex production over there, on a quarterly basis or if there is second production adjustment, what was more of a surprise, any color there would be helpful. Thank you.
36;Q&A;Preston Feight - CEO;Firm;Sure. I think I think your comments are reasonably accurate, as we did take the adjustments to Europe, to where -- a point where it matched the market demand. And we've seen that we've held onto our market share gains with our build rates. So we're setting at like 16.4%, which is near historic highs for us, in market share. So we think we have it balanced about right now. And Europe was probably a little sooner coming down than maybe we thought it might be, and that's why we made the necessary adjustments, and it feels like we're setting the right levels.
37;Q&A;Benjamin Burud - Goldman Sachs;Analyst;And then, can you give us an update on how you're thinking about dealer location growth next year, for the TRP locations? Are you still thinking of adding 50 new locations per year, and any expected increase in Kenworth and Peterbilt dealers in 2020?
38;Q&A;Preston Feight - CEO;Firm;Yes. We have -- I mean I'll start by just saying, we have the best dealer network in the industry, and I mean spent a lot of time with them. They're fantastic business partners. We see significant investments from them in North America and in Europe. So it's one way to think about this, is that they're constantly renewing their facilities, and adding service bays and shop capability, to make sure our customers maximize their uptime. And so we'll watch next year that they'll continue to make those investments into new facilities, with lots of great plans around adding locations. And we'll see some location growth in North America. What I'd expect more in Europe, is it will be -- the continuing development of replacement locations and improved service bay capability or more service bay capability. And to your point of, TRP Stores, we will be adding TRP Stores in 2020 as well, probably much along the lines as we have, in this year.
39;Q&A;Operator;Operator;Our next question comes from Tim Thein with Citigroup. Your line is now open.
40;Q&A;Timothy Thein - Citigroup;Analyst;First question, just on a -- from a mix standpoint, this revenue per truck that -- call it 10% or almost 10% year-over-year growth, was that just all that contribution from North America being a bigger part of the deliveries, or is there kind of underlying content growth or mix story that's also contributing?
41;Q&A;Preston Feight - CEO;Firm;No, you've got it about right. It's mostly contribution from North America.
42;Q&A;Timothy Thein - Citigroup;Analyst;Okay.
43;Q&A;Harrie Schippers - President & CFO;Firm;Pricing improvement, right?
44;Q&A;Preston Feight - CEO;Firm;Yes.
45;Q&A;Timothy Thein - Citigroup;Analyst;"Right, okay. And then just back on the Financial Services and the pre-tax profits; in terms of the increase, I know that we have limited disclosure here in the release. But the increase in that interest and other line, how much of that is a change in terms of higher depreciation, that we will potentially be sustained going forward, versus maybe impairments or losses on used, that are presumably more one-time in nature? And the spirit of the question is just, should we assume a kind of a similar run rate in terms of a -- from a profitability perspective in the third quarter, or were there some kind of one timer's within that line? Thank you."
46;Q&A;Preston Feight - CEO;Firm;So as far as the continuing to profitability, we think the strong profits we had in the third quarter will continue going forward and for the detail of your question, I will let Michael want to address that one.
47;Q&A;Michael Barkley - SVP & Controller;Firm;Yes. We did have some impairments that were taken, and we also adjusted our depreciation to reflect expected future impairments. And so that run rate will continue going forward. And as Preston indicated, will be reflected at a similar pace in coming quarters.
48;Q&A;Operator;Operator;Our next question comes from Ross Gilardi with Bank of America. Your line is now open.
49;Q&A;Ross Gilardi - Bank of America;Analyst;I'm just trying to understand gross margins in a more draconian scenario than what you're forecasting for next year. I mean, I think if you go back in gross margins ex R&D in more of a garden-variety downturn have been around 12% to 13%. But you've got to go back like seven or eight years to see it. I'm just wondering, how do you think gross margins look in the next downturn, whenever it comes, in relation to that 12% to 13%, given the way the company has evolved over the last decade, particularly with the growth in the Parts business?
50;Q&A;Preston Feight - CEO;Firm;I think one of the great strengths of PACCAR, is that we are always looking at operational efficiency gains, not just in one year, but over the course of time. We're always thinking about cost control. So as we head into markets like the normalized market we're facing, we've already been aggressively thinking about cost control, and I think that's enabled us to deliver the solid gross margins we had this quarter, and even the quarterly gross margins we predict for next quarter in 14% to 14.5%. So I think that we are always managing the business efficiently for the benefit of our customers, and we think that 14% to 14.5% that we deliver next quarter will be pretty solid.
51;Q&A;Ross Gilardi - Bank of America;Analyst;Yes, I mean, I realize that. I wasn't asking about next quarter. I'm not asking you for it to forecast when the next trough is. I'm just saying, when eventually it does come, what do you think your gross margins would look like with -- in comparison to what prior downturns looked like? I mean, I imagine you're -- it has been very difficult to stay in the 14% to 14.5% range, if Class 8 build -- goes to sub 200,000 number.
52;Q&A;Preston Feight - CEO;Firm;Well, that's kind of hypothetical to us. Just to think where it might go down to and how we might react in those circumstances. But you can imagine, that we will always be focused on cost control, and we have a long, long history of all different markets back through the recession of 2009, and we still continue with profitability and we'll continue to do a good job in those, even if those circumstances were to return, which we don't predict.
53;Q&A;Ross Gilardi - Bank of America;Analyst;How quickly can you reduce SG&A, as Class 8 production normalizes, and what will be the source of the savings? And just how should we think about SG&A into next year, as we revert back to replacement level demand? I mean if we model it at 2.3% of sales or so for this year, does it stay at that ratio in 2020, as production normalizes, or do we see it -- the ratio move higher?
