;section;speaker;role;text
116;Q&A;Preston Feight - CEO;Firm;Yes. That's interesting. We do have -- in North America all of our trucks are connected. So, the people that can work, trucks are connected. And we watch vehicle miles traveled and we watch utilization of the fleet. And while it's down just a little bit, it's also holding up pretty well and remains at high levels over the historical framework.
117;Q&A;Operator;Operator;Your next question comes from the line of Joe O'Dea of Vertical Research.
118;Q&A;Joe O'Dea - Vertical Research;Analyst;With respect to the facility restart and you talked about deploying safety protocols and government regulations and supply chain. Can you talk about any government regulations today that prevent you from operating, and are there protocols that you have not yet deployed or are sort of facilities ready to operate and regulations aren't restricting you, and it's just about sort of comfort level with supply chain?
119;Q&A;Preston Feight - CEO;Firm;We continue to work in alignment with the initial declarations, which is that trucking is an essential business and the parts supplies and essential business. So, that's one of the things that we work with and then the others to make sure that these best practices we put in for our employees are sufficient and are robust and protect them well. And those two things in alignment are what define our restart strategy.
120;Q&A;Joe O'Dea - Vertical Research;Analyst;And so, you're still rolling out some of those safety protocol actions at facilities?
121;Q&A;Preston Feight - CEO;Firm;Indeed we are and staying lined up with each seat in their directives as well.
122;Q&A;Operator;Operator;Your next question comes from the line of Rob Salmon of Wolfe Research.
123;Q&A;Rob Salmon - Wolfe Research;Analyst;I guess, kind of piggybacking on some of the adjustments you guys have made to the factories to obviously protect the employees and respect social distancing. Is there any cost quantification that you can kind of help us think about whether it's the impact to gross margins or kind of incremental costs per piece associated with the cleaning, with the temperature taking, as well as spacing out employees a little bit more than we would historically have seen?
124;Q&A;Preston Feight - CEO;Firm;No, there's nothing that's that concrete. We take the temperatures of the employees we're going to or as they come back into the factories pre-production, make sure everybody is healthy when they come to work. That's good for everybody. And then, the teams are doing a really good job of just bringing in safety protocols that work with truck production. And that overlay has gone very well in our factories where we're starting up.
125;Q&A;Harrie Schippers - President and CFO;Firm;And like Preston has said, the number one priority is the safety of our employees. And there might be some costs associated with that, but that's not the number one player.
126;Q&A;Rob Salmon - Wolfe Research;Analyst;Of course, you have made that very clear and we'll kind of keep that in mind. As we're looking forward, as we look through kind of the first quarter, can you give us a sense of what the parts revenue cadence was by month? Like, do we see any sort of major difference in your parts revenue in the month of March relative to January-February?
127;Q&A;Preston Feight - CEO;Firm;It was relatively flat through the quarter. I mean, there were weeks and differences by weeks, but it was relatively flat through the first -- for each of the months.
128;Q&A;Rob Salmon - Wolfe Research;Analyst;That's helpful. And then, on the provisions for losses on receivables. With the step up that we saw obviously kind of tied to the economy, are you seeing any difference in terms of the receivables that you have for customers relative to dealers in kind of one of those two channels? Was there a big customer impact? I'm just trying to better understand as we think about the impact looking forward.
129;Q&A;Harrie Schippers - President and CFO;Firm;We talked about the past dues being really low. Most customers are in a good position to pay their bills on time. Finance company is doing well. We're financing a stable portion of the trucks that we sell and with all good well-dated customers that pay their bills.
130;Q&A;Rob Salmon - Wolfe Research;Analyst;I appreciate the time, guys.
131;Q&A;Preston Feight - CEO;Firm;You bet. Have a good day.
132;Q&A;Operator;Operator;Your next question comes from the line of Jeff Kauffman of Loop Capital Management. Your line is open.
133;Q&A;Jeff Kauffman - Loop Capital Management;Analyst;Thank you very much and thank you for taking my question. I guess, two quick questions. Number one, following up on what Jamie was asking earlier. Is it just more deferral on CapEx and R&D or more of a structural adjustment where maybe we're not going to do certain things. And where do you think in terms of -- I think, Jamie was hinting as the EV movement slowing down because low fuel prices and pushing things out. But, in terms of looking at R&D programs or capital spending, where is the flex, and kind of what do you think should be pushed out in this kind of environment?
134;Q&A;Preston Feight - CEO;Firm;Happy to answer that question with you. So, I would say that is whether deferred or canceled, we have a great portfolio of projects. They all have good returns and provide values for our customers. And so with those projects, often what we're looking at right now is, can we do a phase now, can we postpone a phase to a later point. Very few of them will cancel. We just look at how well they can be done and how do we can more efficient in doing them. And as that lies into the EV movement or to autonomous vehicles or connected vehicles, those technologies really continue to be progressing into the truck industry in the coming years. PACCAR is going to continue to be a leader in offering EV vehicles to our customers and developing autonomous vehicles, leveraging partnerships and working with suppliers and doing in-house developments, so that we can have all of those ready when our customers want them. And we will continue to have that leadership position.
135;Q&A;Jeff Kauffman - Loop Capital Management;Analyst;Okay. That answers both questions. Thank you.
136;Q&A;Preston Feight - CEO;Firm;You bet. Thank you.
137;Q&A;Operator;Operator;And there are no further questions in queue at this time. Are there any additional remarks from the Company?
138;Q&A;Preston Feight - CEO;Firm;Yes. I guess, I would just like to close by saying thank you to everybody for the calls. And again, just to recognize the outstanding people in our Company that are doing such a fantastic job and then also to recognize those people that are handling and managing and working with the COVID situation around the world. And our heartfelt thoughts and prayers are with them and we're all going to come through this stronger in the final analysis.
139;Q&A;Operator;Operator;And ladies and gentlemen, this concludes PACCAR's earnings call. Thank you for your participation. You may now disconnect.
