;section;speaker;role;text
23;Q&A;Daryl Adams - President and CEO;Firm;Yes. For sure, I do know the Ram. So we are done with our testing. Vehicle passed. It's ready to go. And some of our customers are in discussions with Stellantis to understand how many vehicles they're going to get for 2022. So it is ready, and we believe we'll see some orders. I'm not sure we'll get them in Q4, but there should be some in early '22 on that vehicle. It did -- the customers liked it when they [indiscernible] And we also, like I said, passed all the durability testing. So we're ready to go. We're just waiting for the orders, which is the typical process. And I'm going to defer to Jon if he has any updates on Mercedes. I've not heard of anything lately.
24;Q&A;Jon Douyard - CFO;Firm;Yes. I mean we do have 3 orders in the backlog, and those will be in production. If not December, it will be early next year.
25;Q&A;Felix Boeschen - Raymond James;Analyst;Got it. Okay. And then -- and I was hoping, Jon, to just follow up quickly on the Specialty Vehicles margins and the commentary around recovering the full cost inflation with price over time. I was wondering, just looking at the backlog in that segment, it seems like that could happen pretty swiftly into early 2022, assuming we run through pricing actions in 4Q. Curious if you would agree/disagree with that statement or how we should think about that sequential ramp there.
26;Q&A;Jon Douyard - CFO;Firm;Yes. No, I think you're right in that. I mean we will see -- we've taken additional pricing in Q4. We will see benefits from pricing that we've already taken earlier in the year incrementally in Q4. And then as we work through that backlog, we will -- early next year, we should be in that recovery piece. I think it's important to note as we look at where the business is today that Q4 will look more like the first half of the year for SV than it did in Q3. And so we expect incremental sequential improvement there in going into next year.
27;Q&A;Operator;Operator;The next question is from Mike Shlisky of D.A. Davidson.
28;Q&A;Mike Shlisky - D.A. Davidson;Analyst;Can I -- I want to maybe touch on FVS performance in the quarter first. It's clear you've had probably fewer challenges than most in securing chassis and securing the parts you need. I mean it's not easy, but you've gotten -- you've done better than most from what we have seen at this point. Do you -- can you maybe share with us whether you've seen better performance from the larger fleets, the big parcel delivery companies, to get these chassis as opposed to the smaller folks? Are they paying up for chassis to make sure they have what they need for the holidays or for next year and certain smaller customers just not getting to same treatment from the Fords or the GMs of the world?
29;Q&A;Jon Douyard - CFO;Firm;I mean, I think when you look at it, I wouldn't necessarily say they're paying off. I think we're -- the discussions that we were having even if you go back to last year was not necessarily on chassis availability, though we did anticipate some issues on that front earlier in the year, but it was more around just the overall demand profile for parcel and last-mile delivery in general. And so given the demand that we were seeing at the time we expected, we worked closely with our customers as well as with our own pool in terms of securing chassis early in the year. And so that's benefited us, I think, through certainly year-to-date. And we continue to work closely with customers as we look at 2022 as well, even though there's some uncertainty in terms of volumes there. And so I think our ability to identify early in the year, you can even go back to Q4 last year, in terms of securing chassis ourselves as well as supporting our customers in that. I think it's a big dynamic and potentially a differentiator.
30;Q&A;Mike Shlisky - D.A. Davidson;Analyst;Got it. I also want to maybe get a little more granularity on some of your comments on EV. There's probably a bit more depth there. So one of your main competitors have been announcing publicly some new agreements with various EV platform providers like a Zeus or an Atlas to develop the next generation of EV vehicles, you must have 4 or 5, if not more than that, out there at this point. And then it's clear you have your own platform coming as well, but that's going to be probably just one class of vehicle. Can you update us as to what you're doing beyond the basic Class III to address the EV sector? Are you signing up more customers for touch of manufacturing or for platform development without announcing them? Or is it just still all to come here?
31;Q&A;Daryl Adams - President and CEO;Firm;Mike, I hope I remembered all your questions, but if I didn't, just please ask. So first, I want to clarify, our EV strategy isn't only Class III. I believe in our Analyst Day we mentioned we're starting with Class III, and we're moving down to Class II and up through Class V, right? So we will have, as we typically do, a one-stop shop for any customer looking for EV product. And it will be all on our chassis and our operating system, so we're not going to be buying any of that, but we will procure, as we typically do with our motorhome chassis, axles, springs and things. We're not going to vertically integrate except in the software for the operating system. And that's Shyft Innovations. So we'll have the ability to build our own product or sell the chassis to others. And then if we look at FVS, they are currently doing some EV builds for other customers, as we would expect, and possibly even doing some upfit for them, which we've talked about in the past. So they're having some good discussions. So as we talked at the Analyst Day, we wanted to make sure that we didn't mix it with FVS and Utilimaster. We want to keep it as a separate group, which, so far, we feel was the right decision. But we will have, in addition to just the chassis, we'll have some other products, I think, to talk to people about in the future.
32;Q&A;Mike Shlisky - D.A. Davidson;Analyst;Okay. And just to kind of clarify there, oftentimes, when a company has partnered with your big competitor in some of these bodies, it's really not their decision, right? The customer can choose to specify Utilimaster or the other guy, correct?
33;Q&A;Daryl Adams - President and CEO;Firm;Absolutely, absolutely.
34;Q&A;Mike Shlisky - D.A. Davidson;Analyst;So it doesn't mean they're going to get the business. Got it.
35;Q&A;Daryl Adams - President and CEO;Firm;And I think, Mike, if you -- sorry to interrupt. If you look at -- there was a report out yesterday by Morgan Stanley that said, when it comes to EVs, it's not demand that's the problem, it's the supply, right? So when people wonder if there's enough appetite out there, the answer from Morgan Stanley anyway is yes. And when they ask, is there enough business for more than a couple of suppliers? I think they also answer that by saying it's a demand problem. So we're very comfortable with where we're at on the EV project, the timing. And as I mentioned, if I could share with you guys what I'm seeing in the progress the team is making, it's really rewarding that we made that decision back and announced the decision back in June.
36;Q&A;Mike Shlisky - D.A. Davidson;Analyst;Got it. If I can just squeeze in one more here, can you update us on the Magnum and Royal business and if you've gotten any good integration benefits? Or has that been put on pause given some of the supply chain issues.
37;Q&A;Daryl Adams - President and CEO;Firm;Sorry. Ask that question again.
38;Q&A;Mike Shlisky - D.A. Davidson;Analyst;I just want to know how things are going with Royal and Magnum and if you have any additional benefits from trying to get the 2 product lines across their footprints and whether you had to pause that because of the supply chain.
39;Q&A;Daryl Adams - President and CEO;Firm;Are you talking more from the strategy standpoint?
40;Q&A;Mike Shlisky - D.A. Davidson;Analyst;Yes, exactly.
41;Q&A;Daryl Adams - President and CEO;Firm;I'll -- I thought it was more towards the financial. But yes, on the strategy side, for sure, we are currently mounting DuraMag bodies in the California locations. We're doing -- mounting DuraMag bodies in Florida as well as doing some of our Royal bodies out of our existing facilities in Florida as well. And I think I mentioned we are building some other bodies in our South Carolina facility to increase capacity for the DuraMag. So we're excited about how that progress and the integration between the 2 are going. And if I can mention again, I mean, Todd Heavin, our COO, was just out at in Maine the last few days. And I talked to him this morning, and he's really excited with the throughput that they're getting due to our lean activities. And we're hoping we'll see the same progress there that we saw in Royal over the last probably year or so when we really focused on improving operations to improve capacity. And it was good to hear the report when it came back.
42;Q&A;Mike Shlisky - D.A. Davidson;Analyst;It sounds like all systems go.
43;Q&A;Operator;Operator;This concludes our question-and-answer session. I would like to turn the conference back over to Juris Pagrabs for closing remarks.
44;Q&A;Juris Pagrabs - Group Treasurer and Head of IR;Firm;Thank you, Kate. For those interested in learning more about Shyft, we'll be participating in a couple of conferences in the next couple of weeks. Next week, at Baird on November 10. And then the Deutsche Bank on Tuesday, November 16. So please sign up if you'd like to learn more. Having said that, thanks for participating in today's call, and have a great day.
45;Q&A;Operator;Operator;The conference has now concluded. Thank you for attending today's presentation. You may now disconnect.
